web-scraper-order,web-scraper-start-url,songs,songs-href,lyrics
"1684637848-394","https://www.letras.com/luis-miguel/mais_acessadas.html","Se Amaban","https://www.letras.com/luis-miguel/1251938/","Y ahora que prendí ya el fuego
Me pierdo como las olas
Y se amaban, se amaban
Se adoraban"
"1684637848-395","https://www.letras.com/luis-miguel/mais_acessadas.html","Se Amaban","https://www.letras.com/luis-miguel/1251938/","Se amaban, como niños como dioses nuevos
Como ángeles azules se entregaban
Se amaban, se adoraban"
"1684637848-396","https://www.letras.com/luis-miguel/mais_acessadas.html","Se Amaban","https://www.letras.com/luis-miguel/1251938/","Me interpuse en sus caminos
Suavemente como niebla
Como lobo ante su presa
Sutilmente la aceche"
"1684637848-397","https://www.letras.com/luis-miguel/mais_acessadas.html","Se Amaban","https://www.letras.com/luis-miguel/1251938/","Desperté pasiones negras en el corazón de ella
Y sembré la mala hierba en el corazón de él
Dejaste su cuerpo, me bebí su boca"
"1684637848-398","https://www.letras.com/luis-miguel/mais_acessadas.html","Se Amaban","https://www.letras.com/luis-miguel/1251938/","Y ahora que prendí ya el fuego
Me pierdo como las olas
Y ahora que prendí ya el fuego
Me pierdo como las olas
Y se amaban, se amaban
Se adoraban"
"1684637851-399","https://www.letras.com/luis-miguel/mais_acessadas.html","Que Tú Te Vas","https://www.letras.com/luis-miguel/108641/","Cantando voy, cantando todo
Cantando lo que da la vida
Pero hoy al intentar, no tuve que contar
Anda de desamor el alma mía"
"1684637851-400","https://www.letras.com/luis-miguel/mais_acessadas.html","Que Tú Te Vas","https://www.letras.com/luis-miguel/108641/","Amando voy, amando todo
Y eso consuela esta tristeza mía
Después de tanto andar
Me llega otro final
Y mas allá que otro fracaso
Me duele imaginar"
"1684637851-401","https://www.letras.com/luis-miguel/mais_acessadas.html","Que Tú Te Vas","https://www.letras.com/luis-miguel/108641/","Que tú te vas, que tú te vas
Y qué hago con mis sueños
Mientras yo pueda olvidar
Ya sé que es sabio el tiempo
Y todo pasará
Pero me duele tanto
Ahora que no estás"
"1684637851-402","https://www.letras.com/luis-miguel/mais_acessadas.html","Que Tú Te Vas","https://www.letras.com/luis-miguel/108641/","Sintiendo estoy sintiendo todo
Dolor, tristeza, soledad y lágrimas
Y trato de ocultar mi muerte en la ciudad
Pero no escapo de este instante
De amarte y tú no estás"
"1684637851-403","https://www.letras.com/luis-miguel/mais_acessadas.html","Que Tú Te Vas","https://www.letras.com/luis-miguel/108641/","Que tú te vas, que tú te vas
Y qué hago con mis sueños
Mientras yo pueda olvidar
Ya sé que es sabio el tiempo
Y todo pasará
Pero me duele tanto
Ahora que no estás"
"1684637854-404","https://www.letras.com/luis-miguel/mais_acessadas.html","Que Te Vaya Bonito","https://www.letras.com/luis-miguel/que-te-vaya-bonito/","Ojalá que te vaya bonito
Ojalá que se acaben tus penas
Que te digan que yo ya no existo
Y conozcas personas más buenas
Que te den lo que no pude darte
Aunque yo te haya dado de todo
Nunca más volveré a molestarte
Te adore, te perdí, ya ni modo"
"1684637854-405","https://www.letras.com/luis-miguel/mais_acessadas.html","Que Te Vaya Bonito","https://www.letras.com/luis-miguel/que-te-vaya-bonito/","Cuantas cosas quedaron prendidas
Hasta dentro del fondo de mi alma
Cuantas luces dejaste encendidas
Yo no se como voy a apagarlas"
"1684637854-406","https://www.letras.com/luis-miguel/mais_acessadas.html","Que Te Vaya Bonito","https://www.letras.com/luis-miguel/que-te-vaya-bonito/","Ojalá que mi amor no te duela
Y te olvides de mi para siempre
Que se llenen de sangre tus venas
Y te vista la vida de suerte
Yo no se si tu ausencia me mate
Aunque tengo mi pecho de acero
Pero nadie me llame cobarde
Sin saber hasta donde la quiero"
"1684637854-407","https://www.letras.com/luis-miguel/mais_acessadas.html","Que Te Vaya Bonito","https://www.letras.com/luis-miguel/que-te-vaya-bonito/","Cuantas cosas quedaron prendidas
Hasta dentro del fondo de mi alma
Cuantas luces dejaste encendidas
Yo no se como voy a apagarlas"
"1684637854-408","https://www.letras.com/luis-miguel/mais_acessadas.html","Que Te Vaya Bonito","https://www.letras.com/luis-miguel/que-te-vaya-bonito/","Ojalá que te vaya bonito"
"1684637857-409","https://www.letras.com/luis-miguel/mais_acessadas.html","Por Ti","https://www.letras.com/luis-miguel/109124/","Se fue la luz, todo calló
Y yo aquí, estoy en un rincón
Soñando amor, te sueño a ti
Y ni siquiera sé por qué
Historia al fin de una pasión
De una condena de un adiós
Alguién dirá, solo es amor
El tiempo lo podrá borrar
Sin ti"
"1684637857-410","https://www.letras.com/luis-miguel/mais_acessadas.html","Por Ti","https://www.letras.com/luis-miguel/109124/","El viento me estremece el corazón
Sin ti
La lluvia se desata alrededor
Sin ti
La noche es un martirio sin final
Sin ti, sin ti, por ti
Por ti
Mis lágrimas no cesan de brotar
Por ti
No hay nada que me pueda consolar
Por ti
La vida ya no es vida sin amor
Por ti, por ti, sin ti"
"1684637857-411","https://www.letras.com/luis-miguel/mais_acessadas.html","Por Ti","https://www.letras.com/luis-miguel/109124/","¿Dónde estarás, en qué lugar
En qué traición te ocultarás?
¿Dónde quedó tu corazón
Que al mío sin piedad mató?
Sin ti"
"1684637857-412","https://www.letras.com/luis-miguel/mais_acessadas.html","Por Ti","https://www.letras.com/luis-miguel/109124/","El viento me estremece el corazón
Sin ti
La lluvia se desata alrededor
Sin ti
La noche es un martirio sin final
Sin ti, sin ti, por ti
Por ti
Mis lágrimas no cesan de brotar
Por ti
No hay nada que me pueda consolar
Por ti
La vida ya no es vida sin amor
Por ti, por ti, sin ti"
"1684637860-413","https://www.letras.com/luis-miguel/mais_acessadas.html","Muñeca Rota","https://www.letras.com/luis-miguel/109151/","Mírate, 
en el espejo
Mírate, 
estás más vieja
Mírate, 
no sé quién eres tú
Mírame, 
yo fui tu amigo
Óyeme, 
lo que te digo
Créeme, 
no sé quién eres tú"
"1684637860-414","https://www.letras.com/luis-miguel/mais_acessadas.html","Muñeca Rota","https://www.letras.com/luis-miguel/109151/","¿Dónde quedó 
aquella amiga fiel
Que me enseñó 
A ser feliz?"
"1684637860-415","https://www.letras.com/luis-miguel/mais_acessadas.html","Muñeca Rota","https://www.letras.com/luis-miguel/109151/","Mírate   
Pregúntate quién eres tú,
Por qué has quemado sin piedad
Tu juventud, mi juventud"
"1684637860-416","https://www.letras.com/luis-miguel/mais_acessadas.html","Muñeca Rota","https://www.letras.com/luis-miguel/109151/","Mírate, 
muñeca rota
Mírate, 
la droga mata
Créeme, 
es más fuerte que tú"
"1684637860-417","https://www.letras.com/luis-miguel/mais_acessadas.html","Muñeca Rota","https://www.letras.com/luis-miguel/109151/","Mírate, 
que aun te quiero
mírate,
que aun te espero
Déjalo, 
vuelve a ser solo tú"
"1684637860-418","https://www.letras.com/luis-miguel/mais_acessadas.html","Muñeca Rota","https://www.letras.com/luis-miguel/109151/","¿dónde quedo
aquella amiga fiel... etc."
"1684637863-419","https://www.letras.com/luis-miguel/mais_acessadas.html","La Juventud","https://www.letras.com/luis-miguel/110096/","Quien sino tú
Es el futuro de este mundo de horror
El encargado de ponerle color
Y una canción a este mundo gris
De la creación"
"1684637863-420","https://www.letras.com/luis-miguel/mais_acessadas.html","La Juventud","https://www.letras.com/luis-miguel/110096/","Quién sino tú
Ha de salvar al hombre, quién sino tú
Este planeta enfermo ya no da más
Tiende a morir, tú lo salvarás
Tú lo salvarás"
"1684637863-421","https://www.letras.com/luis-miguel/mais_acessadas.html","La Juventud","https://www.letras.com/luis-miguel/110096/","Cantemos todos porque la juventud
Viene marchando, es una gran multitud
Que trae al viento la bandera de la paz
Todo cambiará, todo cambiará"
"1684637863-422","https://www.letras.com/luis-miguel/mais_acessadas.html","La Juventud","https://www.letras.com/luis-miguel/110096/","Cantemos todos porque la juventud
Asoma siempre, es como un rayo de luz
Es la esperanza y también la libertad
Todo cambiará, todo cambiará"
"1684637863-423","https://www.letras.com/luis-miguel/mais_acessadas.html","La Juventud","https://www.letras.com/luis-miguel/110096/","Quién sino tú
Es el futuro de este mundo...etc."
"1684637866-424","https://www.letras.com/luis-miguel/mais_acessadas.html","Io Muoio Per Te","https://www.letras.com/luis-miguel/109136/","é da tanto che ti filo tu non vedi  me
come un'ombra io ti spio
sempre dietro a te
ma verrá il momento
e verra pio l'ora
che il mio cuore arrivera volando
e ti dira:
io muoio per te
io muoio per te
io muoio per te
io muoio per te
io muoio per te
io muoio per te
io muoio per te
io muoio per te
io vorrei essere l'aria che respiri tu
la lattina della coca
che hai bevuto tu
ma verra il momento
e verra poi l'ora
che il mio cuore arrivera volando
e ti dira:
io muoio per te....."
"1684637869-425","https://www.letras.com/luis-miguel/mais_acessadas.html","Hasta El Fin","https://www.letras.com/luis-miguel/26123/","Hasta el Fin
 
Musica : Kiko Cibrian
 Letra: Kiko Cibrian
   
No se si tu
te acordaras de mi
Cuando estes cerca de quien
bese tus labios y yo
no quiera aceptar
La triste realidad
de estar tan solo....sin ti...
Tratando de olvidar tu cuerpo
tal vez sin lograrlo
voy amarte hasta el fin....
no se si tu
lloraste alguna vez
pensaste alguna vez
en regresar a mi
nuestra forma de amar
y no estar solo.... aqui...
tratando de olvidar tus besos
tal vez son lograrlo
voy amarte hasta el fin
de este mundo
hasta el fin del dolor
hasta que el mar se seque
y no brille el sol
donde quiera que voy  
quisiera gritar.... lo que siento
para decirte amor
que  voy amarte hasta el fin
hasta el fin de este mundo
hasta el fin del dolor
hasta que el mar se seque
y no brille mas el sol
donde quiera que voy
Quisiera gritar....lo que siento
para decirte amor
que voy amarte hasta el fin...."
"1684637872-426","https://www.letras.com/luis-miguel/mais_acessadas.html","Este Amor","https://www.letras.com/luis-miguel/109126/","Este amor, este amor, este amor
Siempre irá contigo
Por muy lejos que te vayas
Llegará con mis olas
A la orilla de tu playa
Este amor, este amor
Es tu vida en mi vida
Este amor, este amor es
Tu sangre en mi herida
Este amor este amor por ti
Este amor este amor
Es rocío en tu hierba
Este amor, este amor
Es camino en tu huella
Este amor, este amor por tí
Este amor, este amor, este amor
Volará en tus alas
Por el viento y por las aguas
Entre sal y entre brumas
Esta dentro de tu alma
Este amor, este amor es
Tu vida en mi vida este amor
Este amor es tu sangre en mi herida
Este amor, este amor por tí
Este amor, este amor
Es rocío en tu hierba este amor
Este amor es camino en tu huella
Este amor, este amor por tí
Este amor, este amor
Es tu vida en mi vida este amor
Este amor es tu sangre en mi herida
Este amor, este amor por tí
Este amor, este amor
Es rocío en tu hierba este amor
Este amor es camino en tu huella
Este amor, este amor por tí"
"1684637875-427","https://www.letras.com/luis-miguel/mais_acessadas.html","El Tiempo Que Te Quede Libre","https://www.letras.com/luis-miguel/26152/","El tiempo que te quede libre
Si te es posible, dedícalo a mí
A cambio de mi vida entera
O lo que me queda y que te ofrezco yo"
"1684637875-428","https://www.letras.com/luis-miguel/mais_acessadas.html","El Tiempo Que Te Quede Libre","https://www.letras.com/luis-miguel/26152/","Atiende preferentemente
A toda esa gente que te pide amor
Pero el tiempo que te quede libre
Si te es posible, dedícalo a mí"
"1684637875-429","https://www.letras.com/luis-miguel/mais_acessadas.html","El Tiempo Que Te Quede Libre","https://www.letras.com/luis-miguel/26152/","El tiempo que te quede libre
Si te es posible, dedícalo a mí"
"1684637875-430","https://www.letras.com/luis-miguel/mais_acessadas.html","El Tiempo Que Te Quede Libre","https://www.letras.com/luis-miguel/26152/","No importa que sean dos minutos
O si es uno solo, yo seré feliz
Con tal de que vivamos juntos
Lo mejor de todo dedicado a mí"
"1684637875-431","https://www.letras.com/luis-miguel/mais_acessadas.html","El Tiempo Que Te Quede Libre","https://www.letras.com/luis-miguel/26152/","Y luego cuando te reclamen
Y otra vez te llamen volveré a decir
Que el tiempo que te quede libre
Si te es posible, dedícalo a mí"
"1684637875-432","https://www.letras.com/luis-miguel/mais_acessadas.html","El Tiempo Que Te Quede Libre","https://www.letras.com/luis-miguel/26152/","Que el tiempo que te quede libre
Si te es posible, dedícalo a mí"
"1684637875-433","https://www.letras.com/luis-miguel/mais_acessadas.html","El Tiempo Que Te Quede Libre","https://www.letras.com/luis-miguel/26152/","No importa que sean dos minutos
O si es uno solo, yo seré feliz
Con tal de que vivamos juntos
Lo mejor de todo dedicado a mí"
"1684637875-434","https://www.letras.com/luis-miguel/mais_acessadas.html","El Tiempo Que Te Quede Libre","https://www.letras.com/luis-miguel/26152/","Y luego cuando te reclamen
Y otra vez te llamen volveré a decir
Que el tiempo que te quede libre
Si te es posible, dedícalo a mí"
"1684637875-435","https://www.letras.com/luis-miguel/mais_acessadas.html","El Tiempo Que Te Quede Libre","https://www.letras.com/luis-miguel/26152/","Que el tiempo que te quede libre
Si te es posible, dedícalo a mí"
"1684637875-436","https://www.letras.com/luis-miguel/mais_acessadas.html","El Tiempo Que Te Quede Libre","https://www.letras.com/luis-miguel/26152/","Y luego cuando te reclamen
Y otra vez te llamen volveré a decir
Que el tiempo que te quede libre
Si te es posible, dedícalo a mí"
"1684637875-437","https://www.letras.com/luis-miguel/mais_acessadas.html","El Tiempo Que Te Quede Libre","https://www.letras.com/luis-miguel/26152/","Que el tiempo que te quede libre
Si te es posible, dedícalo a mí"
"1684637878-438","https://www.letras.com/luis-miguel/mais_acessadas.html","Decide Amor","https://www.letras.com/luis-miguel/decide-amor/","Outra vez estamos
Sós na minha casa
No meu quarto
Nada mais que a luz de um abajur"
"1684637878-439","https://www.letras.com/luis-miguel/mais_acessadas.html","Decide Amor","https://www.letras.com/luis-miguel/decide-amor/","Te tomei nos braços
Te beijei a boca
Mas tiveste medo
De ficar e se entregar"
"1684637878-440","https://www.letras.com/luis-miguel/mais_acessadas.html","Decide Amor","https://www.letras.com/luis-miguel/decide-amor/","Decide amor
Sei que esta é a primeira vez
Para mim também e eu só queria
Que fosse contigo"
"1684637878-441","https://www.letras.com/luis-miguel/mais_acessadas.html","Decide Amor","https://www.letras.com/luis-miguel/decide-amor/","Decide amor
Vem comigo conhecer o amor
Vamos juntos descobrir um segredo
Esquece o teu medo
Decide amor"
"1684637878-442","https://www.letras.com/luis-miguel/mais_acessadas.html","Decide Amor","https://www.letras.com/luis-miguel/decide-amor/","Como toda noite
Eu te levo em casa
E às nove e meia já estão a te esperar
E depois sozinho
Olho o teu retrato
Sonho com teu rosto
E em silêncio sinto amor"
"1684637878-443","https://www.letras.com/luis-miguel/mais_acessadas.html","Decide Amor","https://www.letras.com/luis-miguel/decide-amor/","Decide amor
Sei que esta é a primeira vez
Para mim também e eu só queria
Que fosse contigo"
"1684637878-444","https://www.letras.com/luis-miguel/mais_acessadas.html","Decide Amor","https://www.letras.com/luis-miguel/decide-amor/","Decide amor
Vem comigo conhecer o amor
Vamos juntos descobrir um segredo
Esquece o teu medo
Decide amor"
"1684637881-445","https://www.letras.com/luis-miguel/mais_acessadas.html","¿Qué Sabes Tú?","https://www.letras.com/luis-miguel/108660/","Tú no sabes nada de la vida
Tú no sabes nada del amor
Eres como una nave a la deriva
Tú vas por el mundo sin razón"
"1684637881-446","https://www.letras.com/luis-miguel/mais_acessadas.html","¿Qué Sabes Tú?","https://www.letras.com/luis-miguel/108660/","¿Qué sabes tú lo que es estar enamorado?
¿Qué sabes tú lo que es vivir ilusionado?
¿Qué sabes tú lo que es sufrir por un cariño?"
"1684637881-447","https://www.letras.com/luis-miguel/mais_acessadas.html","¿Qué Sabes Tú?","https://www.letras.com/luis-miguel/108660/","¿Qué sabes tú lo que es llorar igual que un niño?
¿Qué sabes tú lo que es pasar la noche en vela?
¿Qué sabes tú lo que es querer sin que te quieran?"
"1684637881-448","https://www.letras.com/luis-miguel/mais_acessadas.html","¿Qué Sabes Tú?","https://www.letras.com/luis-miguel/108660/","¿Qué sabes tú lo que es tener la fe perdida?
Que sabes tú, si tú no sabes nada de la vida"
"1684637881-449","https://www.letras.com/luis-miguel/mais_acessadas.html","¿Qué Sabes Tú?","https://www.letras.com/luis-miguel/108660/","¿Que sabes tú lo que es sufrir por un cariño?
¿Que sabes tú lo que es llorar igual que un niño?
¿Que sabes tú lo que es pasar la noche en vela?
¿Que sabes tú lo que es querer sin que te quieran?"
"1684637881-450","https://www.letras.com/luis-miguel/mais_acessadas.html","¿Qué Sabes Tú?","https://www.letras.com/luis-miguel/108660/","¿Que sabes tú lo que es tener la fe perdida?
¿Que sabes tú, si tú no sabes nada de la vida"
"1684637881-451","https://www.letras.com/luis-miguel/mais_acessadas.html","¿Qué Sabes Tú?","https://www.letras.com/luis-miguel/108660/","¿Qué sabes tú lo que es tener la fe perdida?
¿Que sabes tú si tú no sabes nada de la vida"
"1684637884-452","https://www.letras.com/luis-miguel/mais_acessadas.html","Tu Imaginación","https://www.letras.com/luis-miguel/1251939/","Tu imaginación se funde con la realidad
Cuando me hablas de tu vida why te empiezo a amar
Háblame sin fin de tus fantasías
De tu ansiedad"
"1684637884-453","https://www.letras.com/luis-miguel/mais_acessadas.html","Tu Imaginación","https://www.letras.com/luis-miguel/1251939/","Llévame a tu mundo
Excitante mundo de amor why amar"
"1684637884-454","https://www.letras.com/luis-miguel/mais_acessadas.html","Tu Imaginación","https://www.letras.com/luis-miguel/1251939/","Porque tú me das
La felicidad, la diversidad
Porque tú me das
Algo especial"
"1684637884-455","https://www.letras.com/luis-miguel/mais_acessadas.html","Tu Imaginación","https://www.letras.com/luis-miguel/1251939/","Porque tú me das
Sensibilidad why esa ambigüedad
Porque tú me das
Mucho, mucho más"
"1684637884-456","https://www.letras.com/luis-miguel/mais_acessadas.html","Tu Imaginación","https://www.letras.com/luis-miguel/1251939/","Háblame sin fin de tus fantasías
De tu ansiedad"
"1684637884-457","https://www.letras.com/luis-miguel/mais_acessadas.html","Tu Imaginación","https://www.letras.com/luis-miguel/1251939/","Llévame a tu mundo
Excitante mundo de amor why amar"
"1684637884-458","https://www.letras.com/luis-miguel/mais_acessadas.html","Tu Imaginación","https://www.letras.com/luis-miguel/1251939/","Porque tú me das
La felicidad, la diversidad
Porque tú me das
Algo especial"
"1684637884-459","https://www.letras.com/luis-miguel/mais_acessadas.html","Tu Imaginación","https://www.letras.com/luis-miguel/1251939/","Porque tú me das
Sensibilidad why esa ambigüedad
Porque tú me das
Mucho, mucho más"
"1684637884-460","https://www.letras.com/luis-miguel/mais_acessadas.html","Tu Imaginación","https://www.letras.com/luis-miguel/1251939/","Tu imaginación me acelera la vida
Tu imaginación me haré siempre vibrar"
"1684637884-461","https://www.letras.com/luis-miguel/mais_acessadas.html","Tu Imaginación","https://www.letras.com/luis-miguel/1251939/","Porque tú me das
La felicidad, la diversidad
Porque tú me das
Algo especial"
"1684637884-462","https://www.letras.com/luis-miguel/mais_acessadas.html","Tu Imaginación","https://www.letras.com/luis-miguel/1251939/","Porque tú me das
Sensibilidad why esa ambigüedad
Porque tú me das
Mucho, mucho más"
"1684637884-463","https://www.letras.com/luis-miguel/mais_acessadas.html","Tu Imaginación","https://www.letras.com/luis-miguel/1251939/","Porque tú me das
La felicidad, la diversidad
Porque tú me das
Algo muy especial"
"1684637884-464","https://www.letras.com/luis-miguel/mais_acessadas.html","Tu Imaginación","https://www.letras.com/luis-miguel/1251939/","Porque tú me das
Sensibilidad why esa ambigüedad
Porque tú me das
Mucho, mucho más"
"1684637884-465","https://www.letras.com/luis-miguel/mais_acessadas.html","Tu Imaginación","https://www.letras.com/luis-miguel/1251939/","Porque tú me das
La felicidad, la diversidad
Porque tú me das
Algo muy especial"
"1684637887-466","https://www.letras.com/luis-miguel/mais_acessadas.html","No Me Amenaces","https://www.letras.com/luis-miguel/no-me-amenaces/","No me amenaces, no me amenaces
Cuando estés decidida a buscar otra vida
Pues agarra tu rumbo y véte
Pero no me amenaces, no me amenaces
Ya estás grandecita, ya entiendes la vida
Ya sabes lo que haces"
"1684637887-467","https://www.letras.com/luis-miguel/mais_acessadas.html","No Me Amenaces","https://www.letras.com/luis-miguel/no-me-amenaces/","Porque estás que te vas
Y te vas, y te vas, y te vas
Y te vas, y te vas, y no te has ido
Y yo estoy esperando tu amor
Esperando tu amor, esperando tu amor
O esperando tu olvido"
"1684637887-468","https://www.letras.com/luis-miguel/mais_acessadas.html","No Me Amenaces","https://www.letras.com/luis-miguel/no-me-amenaces/","No me amenaces, no me amenaces
Si ya fue tu destino olvidar mi cariño
Pues agarra tu rumbo y véte
Pero no me amenaces, no me amenaces
Ya juega tu suerte, ahí traes la baraja
Pero yo tengo los áses"
"1684637887-469","https://www.letras.com/luis-miguel/mais_acessadas.html","No Me Amenaces","https://www.letras.com/luis-miguel/no-me-amenaces/","Porque estás que te vas
Y te vas, y te vas, y te vas
Y te vas, y te vas, y no te has ido
Y yo estoy esperando tu amor
Esperando tu amor, esperando tu amor
O esperando tu olvido"
"1684637890-470","https://www.letras.com/luis-miguel/mais_acessadas.html","Mentira","https://www.letras.com/luis-miguel/110101/","Mentira que me quieres mucho
Es mentira, no me quieres nada
Mentira que me quieres mucho  
Es mentira, no me quieres nada"
"1684637890-471","https://www.letras.com/luis-miguel/mais_acessadas.html","Mentira","https://www.letras.com/luis-miguel/110101/","Sé que sólo soy un capricho
Que quieres verme de ti enamorado 
y arriba, sabes que me gustas mucho
Por eso dices que me quieres ya
Sabes que me gustas mucho
Por eso dices que me quieres ya"
"1684637890-472","https://www.letras.com/luis-miguel/mais_acessadas.html","Mentira","https://www.letras.com/luis-miguel/110101/","Aunque me digas muchas veces que me quieres
que me abraces y me beses
Yo sé bien que no es verdad
Aunque me digas que has soñado muchas noches   
Que me abrazas y me besas
Yo sé bien que no es verdad"
"1684637893-473","https://www.letras.com/luis-miguel/mais_acessadas.html","Es Por Ti","https://www.letras.com/luis-miguel/1767277/","Esa melodía que se escucha cuando estas
El suave mormullo de las aves al cantar
Al despertar es tu palpitar que me haces suspirar"
"1684637893-474","https://www.letras.com/luis-miguel/mais_acessadas.html","Es Por Ti","https://www.letras.com/luis-miguel/1767277/","El roce de un beso más el toque te piel
Y fue un deseo que me envuelve sin querer
Quiero llevar toda la pasión hacia la eternidad"
"1684637893-475","https://www.letras.com/luis-miguel/mais_acessadas.html","Es Por Ti","https://www.letras.com/luis-miguel/1767277/","Es por ti
Que puedo oír
Donde nace el Sol
Y la ilusión vive del amor
El corazón en un mundo azul"
"1684637893-476","https://www.letras.com/luis-miguel/mais_acessadas.html","Es Por Ti","https://www.letras.com/luis-miguel/1767277/","Es por ti
Que llego ahí
Donde no hay dolor en tu calor
Puedo viajar toda la vida en tu fantasía"
"1684637893-477","https://www.letras.com/luis-miguel/mais_acessadas.html","Es Por Ti","https://www.letras.com/luis-miguel/1767277/","Sé mi abecedario, mi refugio, mi cantar
Lleva entre tus brazos
Este sueño de los dos al navegar
Vamos a escribir la historia y su final"
"1684637893-478","https://www.letras.com/luis-miguel/mais_acessadas.html","Es Por Ti","https://www.letras.com/luis-miguel/1767277/","Es por ti
Que puedo oír
Donde nace el Sol
Y la ilusión vive del amor
El corazón en un mundo azul"
"1684637893-479","https://www.letras.com/luis-miguel/mais_acessadas.html","Es Por Ti","https://www.letras.com/luis-miguel/1767277/","Es por ti
Que llego ahí
Donde no hay dolor en tu calor
Puedo viajar toda la vida en tu fantasía"
"1684637893-480","https://www.letras.com/luis-miguel/mais_acessadas.html","Es Por Ti","https://www.letras.com/luis-miguel/1767277/","Es por ti
Que llego ahí
Donde no hay dolor en tu calor
Puedo viajar toda la vida en tu fantasía"
"1684637893-481","https://www.letras.com/luis-miguel/mais_acessadas.html","Es Por Ti","https://www.letras.com/luis-miguel/1767277/","Es por ti
Que puedo oír
Donde nace el Sol
(Donde nace el Sol)"
"1684637896-482","https://www.letras.com/luis-miguel/mais_acessadas.html","De Nuevo Al Paraíso","https://www.letras.com/luis-miguel/1251934/","De nuevo al paraíso, de nuevo al paraíso
De nuevo al paraíso
De nuevo el Sol, la luz de libertad
La bella realidad sin frenos ni espejismos
De nuevo yo atado solo a mí
Volviendo a ser feliz
Al borde del abismo"
"1684637896-483","https://www.letras.com/luis-miguel/mais_acessadas.html","De Nuevo Al Paraíso","https://www.letras.com/luis-miguel/1251934/","De nuevo al paraíso
De nuevo al paraíso
De nuevo al paraíso
De nuevo al paraíso
De nuevo al paraíso sin ti
Volver a sondear mil corazones
Vivir a mi manera cualquier noche
Sentir la cercanía de unos labios
Y cantar como ayer
Y viajar por esos labios por primera vez
Y viajar por esos labios por primera vez"
