web-scraper-order,web-scraper-start-url,songs,songs-href,lyrics
"1684638073-875","https://www.letras.com/luis-miguel/mais_acessadas.html","Acapulco Amor","https://www.letras.com/luis-miguel/109123/","Cuando esté en mi nube
Te lloverá un beso
Volviendo contigo
Ya seremos dueños
Del cielo y el mar
Cuando, ya caiga la noche
Vamos hacia un mundo nuevo
Que yo te mostraré"
"1684638073-876","https://www.letras.com/luis-miguel/mais_acessadas.html","Acapulco Amor","https://www.letras.com/luis-miguel/109123/","Acapulco amor
Baila conmigo
Gozando del sol
Playa y amigos"
"1684638073-877","https://www.letras.com/luis-miguel/mais_acessadas.html","Acapulco Amor","https://www.letras.com/luis-miguel/109123/","Vamos juntos
Que allá nos espera
Limón y palmeras
Tomando tu coco
Me volverás loco"
"1684638073-878","https://www.letras.com/luis-miguel/mais_acessadas.html","Acapulco Amor","https://www.letras.com/luis-miguel/109123/","Besando tu pelo
Me voy en un vuelo
En paracaídas subiendo
Hasta el cielo"
"1684638073-879","https://www.letras.com/luis-miguel/mais_acessadas.html","Acapulco Amor","https://www.letras.com/luis-miguel/109123/","Cuando esté en mi nube
Te lloverá un beso
Volviendo contigo
Ya seremos dueños
Del cielo y el mar"
"1684638073-880","https://www.letras.com/luis-miguel/mais_acessadas.html","Acapulco Amor","https://www.letras.com/luis-miguel/109123/","Acapulco amor
Acapulco amor
Acapulco amor"
"1684638076-881","https://www.letras.com/luis-miguel/mais_acessadas.html","Vuelve","https://www.letras.com/luis-miguel/97802/","Fotografías y cartas de amor
Sobre la mesa
Cien mil recuerdos de nosotros dos
En mi cabeza"
"1684638076-882","https://www.letras.com/luis-miguel/mais_acessadas.html","Vuelve","https://www.letras.com/luis-miguel/97802/","Calma el dolor de mi corazón
Olvida lo pasado sabes que te amo solo"
"1684638076-883","https://www.letras.com/luis-miguel/mais_acessadas.html","Vuelve","https://www.letras.com/luis-miguel/97802/","¡Vuelve!
Se acaba mi vida si no vuelves
Regresa a mi mundo, mi Sol
Ven por favor
¡Vuelve, mi amor!"
"1684638076-884","https://www.letras.com/luis-miguel/mais_acessadas.html","Vuelve","https://www.letras.com/luis-miguel/97802/","El horizonte se tiñe de gris
En primavera
La medianoche vuelve a sentir
Sin Luna llena"
"1684638076-885","https://www.letras.com/luis-miguel/mais_acessadas.html","Vuelve","https://www.letras.com/luis-miguel/97802/","La obscuridad y la desolación
Se apropian de mi vida
No hay otra salida, solo"
"1684638076-886","https://www.letras.com/luis-miguel/mais_acessadas.html","Vuelve","https://www.letras.com/luis-miguel/97802/","¡Vuelve!
Se acaba mi vida si no vuelves
Regresa a mi mundo, mi Sol
Ven, por favor
¡Vuelve, mi amor!"
"1684638076-887","https://www.letras.com/luis-miguel/mais_acessadas.html","Vuelve","https://www.letras.com/luis-miguel/97802/","Vuelve
Extraño tus besos
Vuelve a sentir como ayer
Una razón de vivir"
"1684638076-888","https://www.letras.com/luis-miguel/mais_acessadas.html","Vuelve","https://www.letras.com/luis-miguel/97802/","¡Vuelve!
Se acaba mi vida si no vuelves
Regresa a mi mundo mi Sol
Ven por favor
¡Vuelve, mi amor!"
"1684638076-889","https://www.letras.com/luis-miguel/mais_acessadas.html","Vuelve","https://www.letras.com/luis-miguel/97802/","Abre las puertas de nuevo
Recuerda aquellos momentos
Llenos de pasión
Llenos de emoción uh, oh"
"1684638076-890","https://www.letras.com/luis-miguel/mais_acessadas.html","Vuelve","https://www.letras.com/luis-miguel/97802/","¡Regresa, amor, te amo tanto!
Mi corazón vive en llanto
¡Vuelve por favor!
¡Quítame el dolor!"
"1684638076-891","https://www.letras.com/luis-miguel/mais_acessadas.html","Vuelve","https://www.letras.com/luis-miguel/97802/","Abre las puertas de nuevo
Recuerda aquellos momentos
Llenos de pasión
Llenos de emoción uh, oh"
"1684638076-892","https://www.letras.com/luis-miguel/mais_acessadas.html","Vuelve","https://www.letras.com/luis-miguel/97802/","¡Regresa, amor, te amo tanto!
Mi corazón vive en llanto
¡Vuelve por favor!
¡Quítame el dolor!"
"1684638079-893","https://www.letras.com/luis-miguel/mais_acessadas.html","Tú Me Acostumbraste","https://www.letras.com/luis-miguel/26161/","Tú me acostumbraste
A todas esas cosas
Y tú me enseñaste
Que son maravillosas"
"1684638079-894","https://www.letras.com/luis-miguel/mais_acessadas.html","Tú Me Acostumbraste","https://www.letras.com/luis-miguel/26161/","Sútil llegaste a mí como una tentación
Llenando de ansiedad mi corazón"
"1684638079-895","https://www.letras.com/luis-miguel/mais_acessadas.html","Tú Me Acostumbraste","https://www.letras.com/luis-miguel/26161/","Yo no comprendía cómo se quería
En tu mundo raro y por ti aprendí
Por eso me pregunto al ver que me olvidaste
Por qué no me enseñaste cómo se vive sin ti"
"1684638079-896","https://www.letras.com/luis-miguel/mais_acessadas.html","Tú Me Acostumbraste","https://www.letras.com/luis-miguel/26161/","Por eso me pregunto al ver que me olvidaste
Por qué no me enseñaste cómo se vive sin ti
Por qué no me enseñaste cómo se vive sin ti
Por qué no me enseñaste cómo se vive sin ti"
"1684638082-897","https://www.letras.com/luis-miguel/mais_acessadas.html","Separados","https://www.letras.com/luis-miguel/109108/","Cuantas noches me acuerdo de ti
Cuantas risas me aburro a morir
Cuanto buen amigo
Es enemigo
De pronto
Sin ti"
"1684638082-898","https://www.letras.com/luis-miguel/mais_acessadas.html","Separados","https://www.letras.com/luis-miguel/109108/","Cuantas veces no quiero dormir
Esperando una historia genial
Pero nunca toca
La noche loca
Sin ti"
"1684638082-899","https://www.letras.com/luis-miguel/mais_acessadas.html","Separados","https://www.letras.com/luis-miguel/109108/","Separados como tontos
Separados porque sí
Separados porque hay algo que va mal
Separados por el frío
Separados al final
Es así
Es lo normal"
"1684638082-900","https://www.letras.com/luis-miguel/mais_acessadas.html","Separados","https://www.letras.com/luis-miguel/109108/","Cuantas veces me siento fatal
Por no hablar lo que tengo que hablar
Por callar tu nombre
En la sombra
Con hambre
De ti"
"1684638082-901","https://www.letras.com/luis-miguel/mais_acessadas.html","Separados","https://www.letras.com/luis-miguel/109108/","Cuantas veces tu nombre escribí
Cuantas veces tu nombre borré
Y te tengo a mano
Y no te llamo
Nunca"
"1684638085-902","https://www.letras.com/luis-miguel/mais_acessadas.html","La Fiesta Del Mariachi","https://www.letras.com/luis-miguel/la-fiesta-del-mariachi/","¿Qué paso mi chula?
Hey hey"
"1684638085-903","https://www.letras.com/luis-miguel/mais_acessadas.html","La Fiesta Del Mariachi","https://www.letras.com/luis-miguel/la-fiesta-del-mariachi/","La fiesta va a comenzar
Adornen esos portones
La fiesta va a comenzar
Adornen esos portones"
"1684638085-904","https://www.letras.com/luis-miguel/mais_acessadas.html","La Fiesta Del Mariachi","https://www.letras.com/luis-miguel/la-fiesta-del-mariachi/","Ya va llegando el mariachi
Cantando sones con sus guitarras y guitarrones
Pa' que se alegren y que retocen los corazones
Ya va llegando el mariachi
Cantando sones con sus guitarras y guitarrones
Pa' que se alegren y que retocen los corazones"
"1684638085-905","https://www.letras.com/luis-miguel/mais_acessadas.html","La Fiesta Del Mariachi","https://www.letras.com/luis-miguel/la-fiesta-del-mariachi/","Ay lalala lalay
Ay lalala lalay
Agarre su falda pa' que se baile este lindo son
Ay lalala lalay
Ay lalala lalay
Saque polvadera pa' que retoce mi corazón
Ay ay ay"
"1684638085-906","https://www.letras.com/luis-miguel/mais_acessadas.html","La Fiesta Del Mariachi","https://www.letras.com/luis-miguel/la-fiesta-del-mariachi/","La fiesta sigue bonita
Toda llena de alegria
La fiesta sigue bonita
Toda llena de alegria"
"1684638085-907","https://www.letras.com/luis-miguel/mais_acessadas.html","La Fiesta Del Mariachi","https://www.letras.com/luis-miguel/la-fiesta-del-mariachi/","Sigue tocando el mariachi
Con sus violines, con sus trompetas y la vigüela
Pa' que se alegre y se contente mi linda nena
Sigue tocando el mariachi
Con sus violines, con sus trompetas y la vigüela
Pa' que se alegre y se contente mi linda nena"
"1684638085-908","https://www.letras.com/luis-miguel/mais_acessadas.html","La Fiesta Del Mariachi","https://www.letras.com/luis-miguel/la-fiesta-del-mariachi/","Ay lalala lalay
Ay lalala lalay
Agarre su falda pa' que se baile este lindo son
Ay lalala lalay
Ay lalala lalay
Saque polvadera pa' que retoce mi corazón"
"1684638085-909","https://www.letras.com/luis-miguel/mais_acessadas.html","La Fiesta Del Mariachi","https://www.letras.com/luis-miguel/la-fiesta-del-mariachi/","Es la fiesta del mariachi
La que alegra el corazón"
"1684638088-910","https://www.letras.com/luis-miguel/mais_acessadas.html","Es Mejor","https://www.letras.com/luis-miguel/26139/","Es mejor"
"1684638088-911","https://www.letras.com/luis-miguel/mais_acessadas.html","Es Mejor","https://www.letras.com/luis-miguel/26139/","Se terminó una historia de amor
pues no me quema ya tu piel
Y tus labios no me saben a miel
Ya sé tu puedes decirme lo mismo
entre tú y yo hay un gran avismo
niña, (niña)"
"1684638088-912","https://www.letras.com/luis-miguel/mais_acessadas.html","Es Mejor","https://www.letras.com/luis-miguel/26139/","Es mejor
dejarlo como está
Es mejor
guardar una amistad"
"1684638088-913","https://www.letras.com/luis-miguel/mais_acessadas.html","Es Mejor","https://www.letras.com/luis-miguel/26139/","Ya lo sé
No tengo perdón
Sé que te engañé con alguna
Aunque yo
te amé con locura.
Ya sé tu puedes decirme lo mismo
entre tú y yo hay un gran avismo
niña, (niña)"
"1684638088-914","https://www.letras.com/luis-miguel/mais_acessadas.html","Es Mejor","https://www.letras.com/luis-miguel/26139/","Es mejor
dejarlo como está
Es mejor
guardar una amistad"
"1684638088-915","https://www.letras.com/luis-miguel/mais_acessadas.html","Es Mejor","https://www.letras.com/luis-miguel/26139/","Es mejor
dejarlo como está
Es mejor
guardar una amistad"
"1684638088-916","https://www.letras.com/luis-miguel/mais_acessadas.html","Es Mejor","https://www.letras.com/luis-miguel/26139/","Qué gran distancia me separa de tí
es enorme años luz
yo soy el norte
tu eres el sur
Ya tú puedes decirme lo mismo
entre tú y yo hay un gran avismo
niña, (niña)"
"1684638088-917","https://www.letras.com/luis-miguel/mais_acessadas.html","Es Mejor","https://www.letras.com/luis-miguel/26139/","Es mejor
dejarlo como está
Es mejor
guardar una amistad"
"1684638091-918","https://www.letras.com/luis-miguel/mais_acessadas.html","Dimelo En Un Beso","https://www.letras.com/luis-miguel/26120/","Con solo un beso
me dijiste todo
me diste la vida
en tus caricias
vivi mi fantasia
en tumirada
vi que eras mia
que en ti yo vivia"
"1684638091-919","https://www.letras.com/luis-miguel/mais_acessadas.html","Dimelo En Un Beso","https://www.letras.com/luis-miguel/26120/","Lo que tus labios no digan
lo que tu cuerpo me pida"
"1684638091-920","https://www.letras.com/luis-miguel/mais_acessadas.html","Dimelo En Un Beso","https://www.letras.com/luis-miguel/26120/","Dimelo en un beso
cuentame el secreto
de tu amor
no me ocultes nada
y dejate llevar
por mi corazon"
"1684638091-921","https://www.letras.com/luis-miguel/mais_acessadas.html","Dimelo En Un Beso","https://www.letras.com/luis-miguel/26120/","No hay nada
como despertar contigo
dormir a tu lado
amandote dia y noche
sin medida
revelame el misterio escondido
si lo has decidido
no necesitas palabras
para decir que me amas"
"1684638091-922","https://www.letras.com/luis-miguel/mais_acessadas.html","Dimelo En Un Beso","https://www.letras.com/luis-miguel/26120/","Estribillo..."
"1684638091-923","https://www.letras.com/luis-miguel/mais_acessadas.html","Dimelo En Un Beso","https://www.letras.com/luis-miguel/26120/","Entregate sin temor
no hay nadie mas
que tu y yo
tu cuerpo pide calor
dame tus labios
y dale refugio a mi amor"
"1684638091-924","https://www.letras.com/luis-miguel/mais_acessadas.html","Dimelo En Un Beso","https://www.letras.com/luis-miguel/26120/","Dimelo en un beso
cuentame el secreto
de tu amor
no me ocultes nada
y dejate llevar
por mi corazon"
"1684638091-925","https://www.letras.com/luis-miguel/mais_acessadas.html","Dimelo En Un Beso","https://www.letras.com/luis-miguel/26120/","Dimelo en un beso
cuentame el secreto
de tu amor
no me ocultes nada
y dejate llevar
por mi corazon"
"1684638094-926","https://www.letras.com/luis-miguel/mais_acessadas.html","De Quién Es Usted?","https://www.letras.com/luis-miguel/1788369/","De quién es usted
A quién ama usted
O a quién pertenece usted"
"1684638094-927","https://www.letras.com/luis-miguel/mais_acessadas.html","De Quién Es Usted?","https://www.letras.com/luis-miguel/1788369/","Quién prende esa luz de sus ojos
Propicia esa hermosa sonrisa
Quién suele anidar en los brazos de usted
Simplemente vive con usted"
"1684638094-928","https://www.letras.com/luis-miguel/mais_acessadas.html","De Quién Es Usted?","https://www.letras.com/luis-miguel/1788369/","De quién es usted
A quién besa usted
Cuando hace el amor usted
Quien busca el momento preciso
Que usted necesita de un beso
Se adueña de todo lo suyo
Mientras yo no puedo conquistarla a usted"
"1684638094-929","https://www.letras.com/luis-miguel/mais_acessadas.html","De Quién Es Usted?","https://www.letras.com/luis-miguel/1788369/","De quién es usted
Por qué le permite que ande sola usted
Quién es dueño de toda usted
Si acaso es consiente de como y tan bella es usted"
"1684638094-930","https://www.letras.com/luis-miguel/mais_acessadas.html","De Quién Es Usted?","https://www.letras.com/luis-miguel/1788369/","De quién es usted
Quien la enciende a usted
Con quién duerme usted
Que no se imagina lo mucho y lo
Tanto que yo la amo a usted"
"1684638094-931","https://www.letras.com/luis-miguel/mais_acessadas.html","De Quién Es Usted?","https://www.letras.com/luis-miguel/1788369/","De quién es usted
De quién es usted"
"1684638097-932","https://www.letras.com/luis-miguel/mais_acessadas.html","Como Fue","https://www.letras.com/luis-miguel/74223/","Cómo fué?
No sé decirte cómo fué,
No sé explicarte que pasó
Pero de tí me enamoré."
"1684638097-933","https://www.letras.com/luis-miguel/mais_acessadas.html","Como Fue","https://www.letras.com/luis-miguel/74223/","Fué una luz
Que iluminó todo mi ser,
Tu risa como un manantial,
Llenó mi vida de inquietud."
"1684638097-934","https://www.letras.com/luis-miguel/mais_acessadas.html","Como Fue","https://www.letras.com/luis-miguel/74223/","Fueron tus ojos o tu boca?
Fueron tus labios o tu voz?
Fué a lo mejor la impaciéncia
de tanto esperar tu llegada."
"1684638097-935","https://www.letras.com/luis-miguel/mais_acessadas.html","Como Fue","https://www.letras.com/luis-miguel/74223/","Más no sé,
No sé decirte cómo fué,
No sé explicarme que pasó,
Pero de tí me enamoré."
"1684638100-936","https://www.letras.com/luis-miguel/mais_acessadas.html","Te Propongo Esta Noche","https://www.letras.com/luis-miguel/26122/","Mirame
A los ojos por favor
Quiero ver
Si te queda algo de amor
De calor,
De ternura o de pasion
De amistad
Puede ser"
"1684638100-937","https://www.letras.com/luis-miguel/mais_acessadas.html","Te Propongo Esta Noche","https://www.letras.com/luis-miguel/26122/","Mirame
Estoy solo pero bien
Te extrañe
Por que siempre te espere
Sabes que
Estas bella amor
Por que no
Lo probamos otra vez?"
"1684638100-938","https://www.letras.com/luis-miguel/mais_acessadas.html","Te Propongo Esta Noche","https://www.letras.com/luis-miguel/26122/","Te propongo esta noche
Al amor darle oportunidad
Olvidar lo pasado
Entre luces y musica bailar
Que hoy es noche de luna llena
Y huele amor
Hay que dejar hablar al corazon"
"1684638100-939","https://www.letras.com/luis-miguel/mais_acessadas.html","Te Propongo Esta Noche","https://www.letras.com/luis-miguel/26122/","Mirame
Tengo ganas de soñar
Suena bien
Que volvamos a empezar
Y si no
Quiero imaginar que tu y yo
Nos amamos de verdad"
"1684638100-940","https://www.letras.com/luis-miguel/mais_acessadas.html","Te Propongo Esta Noche","https://www.letras.com/luis-miguel/26122/","Mirame
Lo que pase pasara
Sabes bien
Que es mejor no programar
Que el amor
Vuelva a ser amor
O tal vez
Tan amigos como siempre"
"1684638100-941","https://www.letras.com/luis-miguel/mais_acessadas.html","Te Propongo Esta Noche","https://www.letras.com/luis-miguel/26122/","Te propongo esta noche
Cuerpo a cuerpo besarnos y volar
Inventando deseos
Y enlugar del olvido al fin amar"
"1684638100-942","https://www.letras.com/luis-miguel/mais_acessadas.html","Te Propongo Esta Noche","https://www.letras.com/luis-miguel/26122/","El amor es tan desigual
Nadie manda en el corazon
Es ternura es desilucion
Placer, dolor
Todo nace del amor"
"1684638100-943","https://www.letras.com/luis-miguel/mais_acessadas.html","Te Propongo Esta Noche","https://www.letras.com/luis-miguel/26122/","Te propongo esta noche
Al amor darle oportunidad
Olvidar lo pasado
Entre luces y musica bailar
Que hoy es noche de luna llena
Y huele amor
Hay que dejar hablar al corazon"
"1684638100-944","https://www.letras.com/luis-miguel/mais_acessadas.html","Te Propongo Esta Noche","https://www.letras.com/luis-miguel/26122/","Te propongo esta noche
Cuerpo a cuerpo besarnos y volar
Inventando deseos
Y en lugar del olvido al fin amar
Que hoy es noche de luna llena
Y huele amor
Hay que dejar hablar al corazon"
"1684638100-945","https://www.letras.com/luis-miguel/mais_acessadas.html","Te Propongo Esta Noche","https://www.letras.com/luis-miguel/26122/","Te propongo esta noche
Al amor darle oportunidad
Olvidar lo pasado
Entre luces y musica bailar
Que hoy es noche de luna llena
Y huele amor
Hay que dejar hablar al corazon"
"1684638100-946","https://www.letras.com/luis-miguel/mais_acessadas.html","Te Propongo Esta Noche","https://www.letras.com/luis-miguel/26122/","Te propongo esta noche
Dejate llevar, vamos a volar
Te propongo esta noche
Dejate llevar, vamos a volar
Que hoy es noche de luna llena
Y huele amor
Hay que dejar hablar al corazon"
"1684638103-947","https://www.letras.com/luis-miguel/mais_acessadas.html","Santa Claus Llegó a La Ciudad","https://www.letras.com/luis-miguel/945987/","Sabes, mi amor
Pórtate bien
No debes llorar
¿Sabes por qué?
Santa Claus llegó a la ciudad"
"1684638103-948","https://www.letras.com/luis-miguel/mais_acessadas.html","Santa Claus Llegó a La Ciudad","https://www.letras.com/luis-miguel/945987/","Él todo lo apunta
Él todo lo ve
Te sigue los pasos, estés donde estés
Santa Claus llegó a la ciudad"
"1684638103-949","https://www.letras.com/luis-miguel/mais_acessadas.html","Santa Claus Llegó a La Ciudad","https://www.letras.com/luis-miguel/945987/","Te observa cuando duermes
Te mira al despertar
No intentes ocultarte de él
Pues siempre te verá"
"1684638103-950","https://www.letras.com/luis-miguel/mais_acessadas.html","Santa Claus Llegó a La Ciudad","https://www.letras.com/luis-miguel/945987/","Él sabe de ti
Él sabe de mí
Lo sabe todo
No intentes huir
Santa Claus llegó a la ciudad"
"1684638103-951","https://www.letras.com/luis-miguel/mais_acessadas.html","Santa Claus Llegó a La Ciudad","https://www.letras.com/luis-miguel/945987/","Santa Claus llegó a la ciudad
Santa Claus llegó a la ciudad"
"1684638103-952","https://www.letras.com/luis-miguel/mais_acessadas.html","Santa Claus Llegó a La Ciudad","https://www.letras.com/luis-miguel/945987/","Te observa cuando duermes
Te mira al despertar
No intentes ocultarte de él
Pues siempre te verá"
"1684638103-953","https://www.letras.com/luis-miguel/mais_acessadas.html","Santa Claus Llegó a La Ciudad","https://www.letras.com/luis-miguel/945987/","Él sabe de ti
Él sabe de mí
Lo sabe todo
No intentes huir
Santa Claus llegó
Santa Claus llegó
Santa Claus llegó a la ciudad"
"1684638106-954","https://www.letras.com/luis-miguel/mais_acessadas.html","No Existen Límites","https://www.letras.com/luis-miguel/1788367/","No existen límites, cuando mis labios se deslizan en tu boca
Inenarrable esa humedad que se acrecenta en mis deseos
Cuando tu beso se me cuela hasta el alma
Cuando mi cuerpo se acomoda en tu figura
Se acaba todo y es que no hay limites"
"1684638106-955","https://www.letras.com/luis-miguel/mais_acessadas.html","No Existen Límites","https://www.letras.com/luis-miguel/1788367/","No existen límites
Cuando me afianzo de ese tiempo en que eres mía
Ese delirio donde se excede lo irreal, lo inexistente
Y es que lo nuestro nunca vuelve a repetirse
Mira que te oigo hablar y puedo derretirme
Adiós los límites, todo es pasión
No existen límites
Cuando tú y yo le damos rienda suelta a nuestro amor"
"1684638106-956","https://www.letras.com/luis-miguel/mais_acessadas.html","No Existen Límites","https://www.letras.com/luis-miguel/1788367/","Y es que lo nuestro nunca vuelve a repetirse
Mira que te oigo hablar y puedo derretirme
Adiós los límites, todo es pasión
No existen límites
Cuando tú y yo le damos rienda suelta a nuestro amor"
"1684638109-957","https://www.letras.com/luis-miguel/mais_acessadas.html","Me Muero Por Ti","https://www.letras.com/luis-miguel/109148/","Hace tiempo que te miro 
cuando no me ves
Hace tiempo que te sigo
te conozco bien"
"1684638109-958","https://www.letras.com/luis-miguel/mais_acessadas.html","Me Muero Por Ti","https://www.letras.com/luis-miguel/109148/","Llegará el momento
Llegará la hora
Y mi corazón irá 
volando y te dirá"
"1684638109-959","https://www.letras.com/luis-miguel/mais_acessadas.html","Me Muero Por Ti","https://www.letras.com/luis-miguel/109148/","Me muero por ti, oh oh
Me muero por ti  
Me muero por ti
Me muero por ti
Me muero por ti"
"1684638109-960","https://www.letras.com/luis-miguel/mais_acessadas.html","Me Muero Por Ti","https://www.letras.com/luis-miguel/109148/","Quien pudiera ser el aire 
que respiras tú
Quien  pudiera ser la almohada 
en la que sueñas tú"
"1684638109-961","https://www.letras.com/luis-miguel/mais_acessadas.html","Me Muero Por Ti","https://www.letras.com/luis-miguel/109148/","Llegará el momento
Llegará la hora
Y mi corazón irá 
volando y te dirá"
"1684638109-962","https://www.letras.com/luis-miguel/mais_acessadas.html","Me Muero Por Ti","https://www.letras.com/luis-miguel/109148/","me muero por ti... etc."
"1684638112-963","https://www.letras.com/luis-miguel/mais_acessadas.html","Lo Que Queda De Mi","https://www.letras.com/luis-miguel/1788366/","Lo que queda de mi
Lo que ves que hay aqui
Te esta esperando"
"1684638112-964","https://www.letras.com/luis-miguel/mais_acessadas.html","Lo Que Queda De Mi","https://www.letras.com/luis-miguel/1788366/","Sigue habiendo en mi amor
y en mis brazos calor
Te sigo amando"
"1684638112-965","https://www.letras.com/luis-miguel/mais_acessadas.html","Lo Que Queda De Mi","https://www.letras.com/luis-miguel/1788366/","Siempre voy hasta al mar
donde un dia tu y yo
Nos prometimos"
"1684638112-966","https://www.letras.com/luis-miguel/mais_acessadas.html","Lo Que Queda De Mi","https://www.letras.com/luis-miguel/1788366/","No dejarnos de amar
No volver a fallar
Eso dijimos"
"1684638112-967","https://www.letras.com/luis-miguel/mais_acessadas.html","Lo Que Queda De Mi","https://www.letras.com/luis-miguel/1788366/","Lo que queda de mi vive solo por ti
Te estoy buscando"
"1684638112-968","https://www.letras.com/luis-miguel/mais_acessadas.html","Lo Que Queda De Mi","https://www.letras.com/luis-miguel/1788366/","Con mi enorme querer te quisiera tener
Te sigo amando"
"1684638112-969","https://www.letras.com/luis-miguel/mais_acessadas.html","Lo Que Queda De Mi","https://www.letras.com/luis-miguel/1788366/","Lo que queda de mi solo quiere saber
Si en los tiempos de lluvia te acuerdas de mi
Porque yo como ves lo que queda de mi
Sigue siendo de ti"
"1684638112-970","https://www.letras.com/luis-miguel/mais_acessadas.html","Lo Que Queda De Mi","https://www.letras.com/luis-miguel/1788366/","Lo que queda de mi solo quiere saber
Si en los tiempos de lluvia te acuerdas de mi
Porque yo como ves lo que queda de mi
Sigue siendo de ti"
"1684638112-971","https://www.letras.com/luis-miguel/mais_acessadas.html","Lo Que Queda De Mi","https://www.letras.com/luis-miguel/1788366/","Lo que queda de mi"
"1684638115-972","https://www.letras.com/luis-miguel/mais_acessadas.html","Delirio","https://www.letras.com/luis-miguel/108680/","Si pudiera expresarte
Como es de inmenso
En el fondo de mi corazón
Mi amor por ti"
"1684638115-973","https://www.letras.com/luis-miguel/mais_acessadas.html","Delirio","https://www.letras.com/luis-miguel/108680/","Este amor delirante
Que abraza a mi alma
Es pasión que atormenta
A mi corazón"
"1684638115-974","https://www.letras.com/luis-miguel/mais_acessadas.html","Delirio","https://www.letras.com/luis-miguel/108680/","Siempre tú estás conmigo en mi tristeza
Estás en mi alegría
Y en mi sufrir"
"1684638115-975","https://www.letras.com/luis-miguel/mais_acessadas.html","Delirio","https://www.letras.com/luis-miguel/108680/","Porque en ti se encierra toda mi vida
Si no estoy contigo mi bien
No soy feliz"
"1684638115-976","https://www.letras.com/luis-miguel/mais_acessadas.html","Delirio","https://www.letras.com/luis-miguel/108680/","Es pasión, delirio de estar contigo
Y yo soy dichoso mi bien
Porque me quieres también"
"1684638118-977","https://www.letras.com/luis-miguel/mais_acessadas.html","Amanecí En Tus Brazos","https://www.letras.com/luis-miguel/26133/","Amanecí otra vez, entre tus brazos
y desperté llorando, de alegría
me cobijé la cara, con tus manos
para seguirte amando, todavía."
