web-scraper-order,web-scraper-start-url,songs,songs-href,lyrics
"1684638301-1357","https://www.letras.com/luis-miguel/mais_acessadas.html","Cómplices","https://www.letras.com/luis-miguel/1251933/","Tú y yo somos cómplices en el amor
Lo que piensas tú lo pienso yo
Lo que sientes tú, es lo que siento yo
Y es por eso que morimos abrazados en un beso
Nadie sabe lo bonito que es amarnos tú y yo"
"1684638304-1358","https://www.letras.com/luis-miguel/mais_acessadas.html","Cielo Rojo","https://www.letras.com/luis-miguel/108654/","Sólo sin tu cariño
Voy caminando, voy caminando
Y no sé que hacer
Ni el cielo me contesta
Cuando pregunto por tí mi bien"
"1684638304-1359","https://www.letras.com/luis-miguel/mais_acessadas.html","Cielo Rojo","https://www.letras.com/luis-miguel/108654/","No he podido olvidarte
Desde la noche, desde la noche
En que te perdí
Sombras de duda y celos
Sólo me envuelven pensando en ti"
"1684638304-1360","https://www.letras.com/luis-miguel/mais_acessadas.html","Cielo Rojo","https://www.letras.com/luis-miguel/108654/","Deja que yo te busque
Y si te encuentro, y si te encuentro
Vuelve otra vez
Olvida lo pasado
Ya no te acuerdes de aquel ayer"
"1684638304-1361","https://www.letras.com/luis-miguel/mais_acessadas.html","Cielo Rojo","https://www.letras.com/luis-miguel/108654/","Olvida lo pasado
Ya no te acuerdes de aquel ayer"
"1684638304-1362","https://www.letras.com/luis-miguel/mais_acessadas.html","Cielo Rojo","https://www.letras.com/luis-miguel/108654/","Mientras yo estoy dormido
Sueño que vamos los dos muy juntos
A un cielo azul
Pero cuando despierto
El cielo es rojo, me faltas tú"
"1684638304-1363","https://www.letras.com/luis-miguel/mais_acessadas.html","Cielo Rojo","https://www.letras.com/luis-miguel/108654/","Aunque yo sea culpable
De aquella triste, de aquella triste
Separación
Vuelve por Dios tus ojos
Vuelve a quererme, vuelve mi amor"
"1684638304-1364","https://www.letras.com/luis-miguel/mais_acessadas.html","Cielo Rojo","https://www.letras.com/luis-miguel/108654/","Deja que yo te busque"
"1684638307-1365","https://www.letras.com/luis-miguel/mais_acessadas.html","Ayer","https://www.letras.com/luis-miguel/108683/","Hoy en un sueño te encontré
Como un loco te bese
Y estrenamos nuestro amor
Hoy lejos de la realidad
Conocí la eternidad
En un abrazo tuyo
Como me duele saber
Que esto es algo que solo soñé
Nos desgarramos de placer
Una promesa quedo
Nos juramos lealtad sin testigos
Comprometimos el alma
Hoy me doy cuenta que te ame
Que mi vida la deje
En un sueño que soñé
Ayer... Ayer
Como me duele saber
Que esto es algo que solo soñé
Nos desgarramos de placer
Una promesa quedo
Nos juramos lealtad sin testigos
Comprometidos
Tu y yo unidos
Comprometimos el alma
Hoy me doy cuenta que te ame
Que mi vida la deje
En un sueño que soñé
Ayer"
"1684638310-1366","https://www.letras.com/luis-miguel/mais_acessadas.html","Sueña","https://www.letras.com/luis-miguel/108645/","Sueña
Con un mañana
Un mundo nuevo
Debe llegar"
"1684638310-1367","https://www.letras.com/luis-miguel/mais_acessadas.html","Sueña","https://www.letras.com/luis-miguel/108645/","Ten fé
Es muy posible
Si tú estás
Decidido"
"1684638310-1368","https://www.letras.com/luis-miguel/mais_acessadas.html","Sueña","https://www.letras.com/luis-miguel/108645/","Sueña
Que no existen fronteras
Y amor sin barreras
No mires atrás"
"1684638310-1369","https://www.letras.com/luis-miguel/mais_acessadas.html","Sueña","https://www.letras.com/luis-miguel/108645/","Vive
Con la emoción
De volver a sentir, a vivir
La paz"
"1684638310-1370","https://www.letras.com/luis-miguel/mais_acessadas.html","Sueña","https://www.letras.com/luis-miguel/108645/","Siembra
En tu camino
Un nuevo destino
Y el sol brillará"
"1684638310-1371","https://www.letras.com/luis-miguel/mais_acessadas.html","Sueña","https://www.letras.com/luis-miguel/108645/","Donde
Las almas se unan en luz
La bondad y el amor
Renacerán"
"1684638310-1372","https://www.letras.com/luis-miguel/mais_acessadas.html","Sueña","https://www.letras.com/luis-miguel/108645/","Y el día que encontremos
Ese sueño cambiarás
No habrá nadie que destruya
De tu alma la verdad"
"1684638310-1373","https://www.letras.com/luis-miguel/mais_acessadas.html","Sueña","https://www.letras.com/luis-miguel/108645/","Sueña
Que no existen fronteras
Y amor sin barreras
No mires atrás"
"1684638310-1374","https://www.letras.com/luis-miguel/mais_acessadas.html","Sueña","https://www.letras.com/luis-miguel/108645/","Ten fé
Es muy posible
Si tú estás
Decidido"
"1684638310-1375","https://www.letras.com/luis-miguel/mais_acessadas.html","Sueña","https://www.letras.com/luis-miguel/108645/","Sueña
Con un mundo distinto
Donde todos los días
El sol brillará"
"1684638310-1376","https://www.letras.com/luis-miguel/mais_acessadas.html","Sueña","https://www.letras.com/luis-miguel/108645/","Donde
Las almas se unan en luz
La bondad y el amor
Renacerán"
"1684638310-1377","https://www.letras.com/luis-miguel/mais_acessadas.html","Sueña","https://www.letras.com/luis-miguel/108645/","Sueña, sueña tú"
"1684638310-1378","https://www.letras.com/luis-miguel/mais_acessadas.html","Sueña","https://www.letras.com/luis-miguel/108645/","Sueña"
"1684638313-1379","https://www.letras.com/luis-miguel/mais_acessadas.html","Por Favor Señora","https://www.letras.com/luis-miguel/109112/","Por favor señora no se me ofenda
No desprecio su amor, comprenda
Es Usted muy bella, es Usted perfecta
Pero entienda, que yo busco otra senda"
"1684638313-1380","https://www.letras.com/luis-miguel/mais_acessadas.html","Por Favor Señora","https://www.letras.com/luis-miguel/109112/","Un amor temprano, olor a fresa
Un amor natural, hierba
Por favor señora no se me ofenda
No la puedo querer, como a ella"
"1684638313-1381","https://www.letras.com/luis-miguel/mais_acessadas.html","Por Favor Señora","https://www.letras.com/luis-miguel/109112/","Una flor artificial, así es Usted
Fiestas, restaurantes, un concierto a las diez
Y al final de esta función
¿Quién sería yo?
Un joven y oscuro seductor"
"1684638313-1382","https://www.letras.com/luis-miguel/mais_acessadas.html","Por Favor Señora","https://www.letras.com/luis-miguel/109112/","Por favor señora, no se me ofenda
No deprecio su amor, comprenda
Yo sé lo agradezco pero qué pena
No me gusta el visón, odio las perlas"
"1684638313-1383","https://www.letras.com/luis-miguel/mais_acessadas.html","Por Favor Señora","https://www.letras.com/luis-miguel/109112/","Una flor artificial, así es Usted
Fiestas, restaurantes, un concierto a las diez
Y al final de esta función
¿Quién sería yo?
Un joven y oscuro seductor"
"1684638316-1384","https://www.letras.com/luis-miguel/mais_acessadas.html","Dormir Contigo","https://www.letras.com/luis-miguel/26119/","Dormir contigo
Es el camino más directo al paraíso
Sentir que sueñas
Mientras te beso y las manos te acaricio"
"1684638316-1385","https://www.letras.com/luis-miguel/mais_acessadas.html","Dormir Contigo","https://www.letras.com/luis-miguel/26119/","Dormir contigo
Es navegar en una estrella hasta el espacio
Es embriagarme
Con el susurro de tu hablar tierno y despacio"
"1684638316-1386","https://www.letras.com/luis-miguel/mais_acessadas.html","Dormir Contigo","https://www.letras.com/luis-miguel/26119/","Dormir contigo
Es conocer la dimensión que tiene un verso
Sentir que duermo
Y al mismo tiempo, conocer el universo"
"1684638316-1387","https://www.letras.com/luis-miguel/mais_acessadas.html","Dormir Contigo","https://www.letras.com/luis-miguel/26119/","Dormir contigo
Con tu cabello acomodado aquí en mis brazos
Y el terciopelo que me brinda tu regazo
¡Qué maravilla dormir contigo!"
"1684638316-1388","https://www.letras.com/luis-miguel/mais_acessadas.html","Dormir Contigo","https://www.letras.com/luis-miguel/26119/","Dormir contigo
Con la ilusión de que despertaré mañana
Con el calor y un nuevo día en la ventana
Fue algo hermoso, amor, dormir contigo"
"1684638316-1389","https://www.letras.com/luis-miguel/mais_acessadas.html","Dormir Contigo","https://www.letras.com/luis-miguel/26119/","Dormir contigo
Con tu cabello acomodado aquí en mis brazos
Y el terciopelo que me brinda tu regazo
¡Qué maravilla dormir contigo!"
"1684638316-1390","https://www.letras.com/luis-miguel/mais_acessadas.html","Dormir Contigo","https://www.letras.com/luis-miguel/26119/","Dormir contigo
Con la ilusión de que despertaré mañana
Con el calor y un nuevo día en la ventana
Fue algo hermoso, amor, dormir contigo"
"1684638319-1391","https://www.letras.com/luis-miguel/mais_acessadas.html","Cómo?","https://www.letras.com/luis-miguel/97789/","¿Cómo imaginar que la vida sigue igual?
¿Cómo si tus pasos ya no cruzan el portal?
¿Cómo pretender esta realidad?
¿Cómo si hasta ayer brillaba el cielo en tu mirar?"
"1684638319-1392","https://www.letras.com/luis-miguel/mais_acessadas.html","Cómo?","https://www.letras.com/luis-miguel/97789/","¿Cómo consolar a la rosa y al jasmín?
¿Cómo si tu risa ya no se oye en el jardín?
¿Cómo he de mentirles que mañana volverás?
¿Cómo despertar si tú no estás?"
"1684638319-1393","https://www.letras.com/luis-miguel/mais_acessadas.html","Cómo?","https://www.letras.com/luis-miguel/97789/","¿Cómo imaginar que la vida sigue igual?
¿Cómo si tus pasos ya no cruzan el portal?
¿Cómo pretender esta realidad?
¿Cómo si hasta ayer brillaba el cielo en tu mirar?"
"1684638319-1394","https://www.letras.com/luis-miguel/mais_acessadas.html","Cómo?","https://www.letras.com/luis-miguel/97789/","¿Cómo consolar a la rosa y al jasmín?
¿Cómo si tu risa ya no se oye en el jardín?
¿Cómo he de mentirles que mañana volverás?
¿Cómo despertar si tú no estás?"
"1684638322-1395","https://www.letras.com/luis-miguel/mais_acessadas.html","Voy a Apagar La Luz / Contigo Aprendí","https://www.letras.com/luis-miguel/26124/","Voy a apagar la luz para pensar en ti
Y así dejar volar a mi imaginación
Ahí donde todo lo puedo donde no hay imposibles
Que importa vivir de ilusiones si así soy feliz"
"1684638322-1396","https://www.letras.com/luis-miguel/mais_acessadas.html","Voy a Apagar La Luz / Contigo Aprendí","https://www.letras.com/luis-miguel/26124/","¿Cómo te abrazaré, cuánto te besaré?
Mis más ardientes anhelos en ti realizaré
Te morderé los labios, me llenaré de ti
Y por eso voy a apagar la luz
Para pensar en ti"
"1684638322-1397","https://www.letras.com/luis-miguel/mais_acessadas.html","Voy a Apagar La Luz / Contigo Aprendí","https://www.letras.com/luis-miguel/26124/","Contigo aprendí
Que existen nuevas y mejores emociones
Contigo aprendí
A conocer un mundo nuevo de ilusiones"
"1684638322-1398","https://www.letras.com/luis-miguel/mais_acessadas.html","Voy a Apagar La Luz / Contigo Aprendí","https://www.letras.com/luis-miguel/26124/","Aprendí
Que la semana tiene más de siete días
Hacer mayores mis contadas alegrías
Y a ser dichoso, yo contigo lo aprendí"
"1684638322-1399","https://www.letras.com/luis-miguel/mais_acessadas.html","Voy a Apagar La Luz / Contigo Aprendí","https://www.letras.com/luis-miguel/26124/","Contigo aprendí
A ver la luz del otro lado de la Luna
Contigo aprendí
Que tu presencia no la cambio por ninguna"
"1684638322-1400","https://www.letras.com/luis-miguel/mais_acessadas.html","Voy a Apagar La Luz / Contigo Aprendí","https://www.letras.com/luis-miguel/26124/","Aprendí que puede un beso ser más dulce y más profundo
Que puedo irme mañana mismo de este mundo
Las cosas buenas ya contigo las viví
Y contigo aprendí
Que yo nací el día en que te conocí"
"1684638325-1401","https://www.letras.com/luis-miguel/mais_acessadas.html","El Dia Que Me Quieras","https://www.letras.com/luis-miguel/84527/","Acariciame en sueño
El suave murmullo
De tu suspirar
Como ríe la vida
Si tus ojos negros
Me quieren mirar
Y si es mío el amparo
De tu risa leve
Que es como un cantar
Ella aquieta mi herida
Todo, todo se olvida"
"1684638325-1402","https://www.letras.com/luis-miguel/mais_acessadas.html","El Dia Que Me Quieras","https://www.letras.com/luis-miguel/84527/","El día que me quieras
La rosa que engalana
Se vestirá de fiesta
Con su mejor color
Y al viento las campanas
Dirán que ya eres mía
Y locas las fontanas
Se contarán su amor"
"1684638325-1403","https://www.letras.com/luis-miguel/mais_acessadas.html","El Dia Que Me Quieras","https://www.letras.com/luis-miguel/84527/","La noche que me quieras
Desde el azul del cielo
Las estrellas celosas
Nos mirarán pasar"
"1684638325-1404","https://www.letras.com/luis-miguel/mais_acessadas.html","El Dia Que Me Quieras","https://www.letras.com/luis-miguel/84527/","Y un rayo misterioso
Hará nido en tu pelo
Luciérnaga curiosa
Que verá que es
Mi consuelo"
"1684638328-1405","https://www.letras.com/luis-miguel/mais_acessadas.html","Decídete","https://www.letras.com/luis-miguel/81101/","Nos quedamos solos
Todos se marcharon
Y en mi cuarto había apenas
Luz en un rincón
Te besé en la cara
Te besé en los labios
Tú sentiste miedo
Y me miraste sin hablar"
"1684638328-1406","https://www.letras.com/luis-miguel/mais_acessadas.html","Decídete","https://www.letras.com/luis-miguel/81101/","Decídete
No lo dudes más
Decídete
Que no puedo resistir
Sin tenerte
Maldita mi suerte"
"1684638328-1407","https://www.letras.com/luis-miguel/mais_acessadas.html","Decídete","https://www.letras.com/luis-miguel/81101/","Decídete
Simplemente, amor
Decídete
Y volemos hacia mundos lejanos
Los dos de la mano
Decídete"
"1684638328-1408","https://www.letras.com/luis-miguel/mais_acessadas.html","Decídete","https://www.letras.com/luis-miguel/81101/","Como cada noche
Vuelvo a acompañarte
A las nueve y media
Te devuelvo a tu mamá"
"1684638328-1409","https://www.letras.com/luis-miguel/mais_acessadas.html","Decídete","https://www.letras.com/luis-miguel/81101/","Luego solo en casa
Mirando tu foto
Sueño con tus ojos
Y en silencio sin tu amor
Decídete"
"1684638331-1410","https://www.letras.com/luis-miguel/mais_acessadas.html","Eres","https://www.letras.com/luis-miguel/97807/","Tras el brillo de un cristal
Tu silueta no dejaba de admirar
Deseaba sólo una señal"
"1684638331-1411","https://www.letras.com/luis-miguel/mais_acessadas.html","Eres","https://www.letras.com/luis-miguel/97807/","Contemplaba tu mirar
Tu hermosura era un sueño tan real
Del que no quise despertar"
"1684638331-1412","https://www.letras.com/luis-miguel/mais_acessadas.html","Eres","https://www.letras.com/luis-miguel/97807/","Y confundí las horas soñando a solas
Loco por tu amor"
"1684638331-1413","https://www.letras.com/luis-miguel/mais_acessadas.html","Eres","https://www.letras.com/luis-miguel/97807/","Eres lo que siempre he amado
Eres lo que yo he esperado
Un poema de amor
Un nuevo mañana"
"1684638331-1414","https://www.letras.com/luis-miguel/mais_acessadas.html","Eres","https://www.letras.com/luis-miguel/97807/","Eres lo que me ha cambiado
Eres el significado
Que me trajo ilusión
Pasión y esperanza"
"1684638331-1415","https://www.letras.com/luis-miguel/mais_acessadas.html","Eres","https://www.letras.com/luis-miguel/97807/","Compartir la intimidad
Fue sentir el ritmo de tu corazón
Mientras hicimos el amor"
"1684638331-1416","https://www.letras.com/luis-miguel/mais_acessadas.html","Eres","https://www.letras.com/luis-miguel/97807/","Apreciar la vida es verte dormida
Aquí a mi lado
Y cobijarme en tu calor
Es confundir las horas estando a solas
Juntos tú y yo"
"1684638331-1417","https://www.letras.com/luis-miguel/mais_acessadas.html","Eres","https://www.letras.com/luis-miguel/97807/","Eres lo que siempre he amado
Eres lo que yo he esperado
Un poema de amor
Un nuevo mañana"
"1684638331-1418","https://www.letras.com/luis-miguel/mais_acessadas.html","Eres","https://www.letras.com/luis-miguel/97807/","Eres lo que me ha cambiado
Eres el significado
Que me trajo ilusión
Pasión y esperanza"
"1684638334-1419","https://www.letras.com/luis-miguel/mais_acessadas.html","Cómo Imaginar","https://www.letras.com/luis-miguel/1819251/","Cómo imaginar que la vida sigue igual
Cómo si tus pasos ya no cruzan el portal
Cómo pretender esta realidad
Cómo si hasta ayer brillaba el cielo en tu mirar."
"1684638334-1420","https://www.letras.com/luis-miguel/mais_acessadas.html","Cómo Imaginar","https://www.letras.com/luis-miguel/1819251/","Cómo consolar a la rosa y al jazmín
Cómo si tu risa ya no se oye en el jardín
Cómo he de mentirles que mañana volverás
Cómo despertar si tú no estás."
"1684638334-1421","https://www.letras.com/luis-miguel/mais_acessadas.html","Cómo Imaginar","https://www.letras.com/luis-miguel/1819251/","Cómo imaginar que la vida sigue igual
Cómo si tus pasos ya no cruzan el portal
Cómo pretender esta realidad
Cómo si hasta ayer brillaba el cielo en tu mirar"
"1684638334-1422","https://www.letras.com/luis-miguel/mais_acessadas.html","Cómo Imaginar","https://www.letras.com/luis-miguel/1819251/","Cómo consolar a la rosa y al jazmín
Cómo si tu risa ya no se oye en el jardín
Cómo he de mentirles que mañana volverás
Cómo despertar si tú no estás."
"1684638337-1423","https://www.letras.com/luis-miguel/mais_acessadas.html","Yo Que No Vivo Sin Ti","https://www.letras.com/luis-miguel/26113/","Nos quedamos solos
Como cada noche
Hoy te siento tristre
Y sé muy bien porque
Tu querrás decirme
He cambiado mucho
El amor se acaba
Y quiero terminar"
"1684638337-1424","https://www.letras.com/luis-miguel/mais_acessadas.html","Yo Que No Vivo Sin Ti","https://www.letras.com/luis-miguel/26113/","Yo que ni un momento puedo estar lejos de ti
¿Cómo soportar la vida entera ya sin ti?
Te quiero, te quiero
Te juro que yo no puedo vivir sin tu amor"
"1684638337-1425","https://www.letras.com/luis-miguel/mais_acessadas.html","Yo Que No Vivo Sin Ti","https://www.letras.com/luis-miguel/26113/","Ven aqui abrazame
Yo te amo tanto
Y te pido porfavor
Que creas más en mi"
"1684638337-1426","https://www.letras.com/luis-miguel/mais_acessadas.html","Yo Que No Vivo Sin Ti","https://www.letras.com/luis-miguel/26113/","Yo que ni un momento puedo estar lejos de ti
¿Cómo soportar la vida entera ya sin ti?
Te quiero, te quiero"
"1684638337-1427","https://www.letras.com/luis-miguel/mais_acessadas.html","Yo Que No Vivo Sin Ti","https://www.letras.com/luis-miguel/26113/","Yo que ni un momento puedo estar lejos de ti
¿Cómo soportar la vida entera ya sin ti?
Te quiero, te quiero, te quiero, te quiero"
"1684638340-1428","https://www.letras.com/luis-miguel/mais_acessadas.html","Soy Como Quiero Ser","https://www.letras.com/luis-miguel/109121/","Soy como quiero ser
Sin mandatos ni fronteras
Soy como quiero ser
La que quiera que me quiera
La que no, que no me quiera"
"1684638340-1429","https://www.letras.com/luis-miguel/mais_acessadas.html","Soy Como Quiero Ser","https://www.letras.com/luis-miguel/109121/","Soy como quiero ser
A nadie impongo mis ideas
Y respeto las de cada quien
Por muy extrañas que sean
Por eso soy como quiero ser
Y amo la libertad de vivir como yo quiera
Por eso quiero que sepas
Que no cambiarás mi senda"
"1684638340-1430","https://www.letras.com/luis-miguel/mais_acessadas.html","Soy Como Quiero Ser","https://www.letras.com/luis-miguel/109121/","Porque yo soy
Como quiero ser
Sin mandatos ni fronteras
Soy como quiero ser
La que quiera que me quiera
La que no, que no me quiera"
"1684638340-1431","https://www.letras.com/luis-miguel/mais_acessadas.html","Soy Como Quiero Ser","https://www.letras.com/luis-miguel/109121/","No navego en barco de papel
Puedo cruzar cualquier mar
Si naufrago alguna vez
No lo debes olvidar
Yo sé que aprenderé a nadar"
"1684638340-1432","https://www.letras.com/luis-miguel/mais_acessadas.html","Soy Como Quiero Ser","https://www.letras.com/luis-miguel/109121/","Porque yo soy
Como quiero ser
Sin mandatos ni fronteras
Soy como quiero ser
La que quiera, que me quiera
La que no, que no me quiera"
"1684638340-1433","https://www.letras.com/luis-miguel/mais_acessadas.html","Soy Como Quiero Ser","https://www.letras.com/luis-miguel/109121/","Soy como quiero ser"
"1684638343-1434","https://www.letras.com/luis-miguel/mais_acessadas.html","Sin Ti","https://www.letras.com/luis-miguel/108676/","Sin ti no podré vivir jamás
Y pensar que nunca más
Estarás junto a mi"
"1684638343-1435","https://www.letras.com/luis-miguel/mais_acessadas.html","Sin Ti","https://www.letras.com/luis-miguel/108676/","Sin ti ¿qué me puede ya importar?
Si lo que me hace llorar
Está lejos de aquí"
"1684638343-1436","https://www.letras.com/luis-miguel/mais_acessadas.html","Sin Ti","https://www.letras.com/luis-miguel/108676/","Sin ti no hay clemencia en mi dolor
La esperanza de mi amor
Te la llevas al fin"
"1684638343-1437","https://www.letras.com/luis-miguel/mais_acessadas.html","Sin Ti","https://www.letras.com/luis-miguel/108676/","Sin ti es inútil vivir
Como inútil será
El quererte olvidar"
"1684638346-1438","https://www.letras.com/luis-miguel/mais_acessadas.html","Si Tu Te Atreves","https://www.letras.com/luis-miguel/1230448/","Me he dado cuenta
Que ha ido surgiendo, poquito a poco
Entre los dos
Una corriente, que nos desborda
Y no contenemos, ni tú ni yo"
"1684638346-1439","https://www.letras.com/luis-miguel/mais_acessadas.html","Si Tu Te Atreves","https://www.letras.com/luis-miguel/1230448/","Ya todos notan, cuando nos vemos
Y yo te presto más atención
Es el momento o fuera o dentro
No hay otra forma, seguir o adiós"
"1684638346-1440","https://www.letras.com/luis-miguel/mais_acessadas.html","Si Tu Te Atreves","https://www.letras.com/luis-miguel/1230448/","Jamás pensamos, que haríamos daño
No somos libres, es un error
Más quién le pone puertas al campo
Y quién le dice que no al amor"
"1684638346-1441","https://www.letras.com/luis-miguel/mais_acessadas.html","Si Tu Te Atreves","https://www.letras.com/luis-miguel/1230448/","Si tú te atreves, por mi vida que te sigo
Si tú me olvidas, te prometo que te olvido
Después de todo, sólo queda un sueño roto
Y evitamos mil héridas, que jamás podrían cerrar"
"1684638346-1442","https://www.letras.com/luis-miguel/mais_acessadas.html","Si Tu Te Atreves","https://www.letras.com/luis-miguel/1230448/","Si tú te atreves, yo renuncio al paraíso
A amar contigo, a soñarte, a que me sueñes
Que al fin y al cabo, más que a nadie nos amamos
Son pasiones ya tan fuertes
Que lo nuestro hay que olvidarlo
Si tú te atreves"
"1684638346-1443","https://www.letras.com/luis-miguel/mais_acessadas.html","Si Tu Te Atreves","https://www.letras.com/luis-miguel/1230448/","Es el momento o fuera o dentro
No hay otra forma, seguir o adiós"
"1684638346-1444","https://www.letras.com/luis-miguel/mais_acessadas.html","Si Tu Te Atreves","https://www.letras.com/luis-miguel/1230448/","Jamás pensamos, que haríamos daño
No somos libres, es un error
Más quién le pone puertas al campo
Y quién le dice que no al amor"
"1684638346-1445","https://www.letras.com/luis-miguel/mais_acessadas.html","Si Tu Te Atreves","https://www.letras.com/luis-miguel/1230448/","Si tú te atreves, por mi vida que te sigo
Si tú me olvidas, te prometo que te olvido
Después de todo, sólo queda un sueño roto
Y evitamos mil héridas, que jamás podrían cerrar"
"1684638346-1446","https://www.letras.com/luis-miguel/mais_acessadas.html","Si Tu Te Atreves","https://www.letras.com/luis-miguel/1230448/","Si tú te atreves, yo renuncio al paraíso
A amar contigo, a soñarte, a que me sueñes
Que al fin y al cabo, más que a nadie nos amamos
Son pasiones ya tan fuertes
Que lo nuestro hay que olvidarlo, si tú te atreves"
"1684638349-1447","https://www.letras.com/luis-miguel/mais_acessadas.html","Oro de Ley","https://www.letras.com/luis-miguel/26141/","Soy legal
Cuando estoy amándote
No dudes más de mí
Yo soy de buena ley
Tengo sangre de rey
Mi estilo no es mentir"
"1684638349-1448","https://www.letras.com/luis-miguel/mais_acessadas.html","Oro de Ley","https://www.letras.com/luis-miguel/26141/","Sé que sí
Que estás arriesgándote
Al entregarte a mí
Has elegido bien
Yo no puedo engañar
A quién me quiere bien"
"1684638349-1449","https://www.letras.com/luis-miguel/mais_acessadas.html","Oro de Ley","https://www.letras.com/luis-miguel/26141/","Oro de ley
Ese es el precio de mi vida
Oro de ley
Ese es mi justo valor
Oro de ley
Ese es el color de mis caricias
Oro de ley
Es el metal del amor"
"1684638349-1450","https://www.letras.com/luis-miguel/mais_acessadas.html","Oro de Ley","https://www.letras.com/luis-miguel/26141/","Créeme
Cuándo estoy
Hablándote
Habla mi corazón
Y cuándo entró en tí
Y me pongo a morir
Ya nunca soy más yo"
"1684638349-1451","https://www.letras.com/luis-miguel/mais_acessadas.html","Oro de Ley","https://www.letras.com/luis-miguel/26141/","Menos mal
Que tú estás mirándome
Fiándote de mí
Has elegido bien
Porqué sabés qué soy
Qué soy oro de ley"
"1684638349-1452","https://www.letras.com/luis-miguel/mais_acessadas.html","Oro de Ley","https://www.letras.com/luis-miguel/26141/","Oro de ley
Ése es el precio de mi vida
Oro de ley
Ése es mi justo valor
Oro de ley
Ése es el color de mis caricias
Oro de ley
Es el metal del amor"
"1684638352-1453","https://www.letras.com/luis-miguel/mais_acessadas.html","Motivos","https://www.letras.com/luis-miguel/108653/","Una rosa pintada de azul 
Es un motivo
Una simple estrellita de mar 
Es un motivo"
"1684638352-1454","https://www.letras.com/luis-miguel/mais_acessadas.html","Motivos","https://www.letras.com/luis-miguel/108653/","Escribir un poema es facil 
Si existe un motivo
Hasta puedo crear mundos nuevos 
En la fantasia"
"1684638352-1455","https://www.letras.com/luis-miguel/mais_acessadas.html","Motivos","https://www.letras.com/luis-miguel/108653/","Unos ojos banados de luz 
Son un motivo
Unos labios queriendo besar 
Son un motivo"
